{
  "schema_version": "v1",
  "type": "travel_deals",
  "capability_tags": ["http", "llm_summarize", "screenshot"],
  "input_spec": { "origin": "SFO", "dest": "JFK", "dates": "flexible" },
  "output_spec": {
    "required_artifacts": [
      { "kind": "log", "count": 1, "label_prefix": "report" },
      { "kind": "screenshot", "count": 1 },
      { "kind": "other", "count": 1, "label_prefix": "deals" }
    ],
    "deals": true,
    "screenshots": true
  },
  "freshness_sla_sec": 1800
}
