{
  "schema_version": "v1",
  "type": "clips_highlights",
  "capability_tags": ["ffmpeg", "llm_summarize", "screenshot"],
  "input_spec": {"vod_url": "https://vod.example/test", "rules": {"peaks": true}},
  "output_spec": {
    "required_artifacts": [
      { "kind": "video", "count": 1, "label_prefix": "clip" },
      { "kind": "other", "count": 1, "label_prefix": "timeline" },
      { "kind": "log", "count": 1, "label_prefix": "report" }
    ],
    "mp4": true,
    "json_timeline": true
  },
  "freshness_sla_sec": 3600
}
