{
  "schema_version": "v1",
  "type": "arxiv_research_plan",
  "capability_tags": ["http", "llm_summarize"],
  "input_spec": { "idea": "example idea" },
  "output_spec": {
    "required_artifacts": [
      { "kind": "log", "count": 1, "label_prefix": "report" },
      { "kind": "other", "count": 1, "label_prefix": "references" }
    ]
  },
  "freshness_sla_sec": 86400
}
