{
  "schema_version": "v1",
  "type": "github_scan",
  "capability_tags": ["http", "llm_summarize"],
  "input_spec": { "idea": "example idea", "license_constraints": "permissive" },
  "output_spec": {
    "required_artifacts": [
      { "kind": "log", "count": 1, "label_prefix": "report" },
      { "kind": "other", "count": 1, "label_prefix": "repos" }
    ]
  },
  "freshness_sla_sec": 86400
}
